{
  "selected_route_ids": [
    1,
    2
  ],
  "target_image": {
    "legend": "Ethanol target",
    "highlight_atoms": [
      0,
      1,
      2
    ]
  },
  "routes": [
    {
      "route_id": 1,
      "why_selected": "Chemically plausible substitution route",
      "overview_grid": {
        "enabled": true,
        "precursor_legends": [
          "Bromoethane",
          "Hydroxide"
        ]
      },
      "tree_view": {
        "enabled": true,
        "caption": "Single-step substitution disconnection"
      },
      "step_views": [
        {
          "step_index": 1,
          "caption": "SN2 substitution"
        }
      ]
    },
    {
      "route_id": 2,
      "why_selected": "Negative-control invalid route",
      "overview_grid": {
        "enabled": true,
        "precursor_legends": [
          "Ethanol"
        ]
      },
      "tree_view": {
        "enabled": true,
        "caption": "Invalid demonstration route"
      },
      "step_views": [
        {
          "step_index": 1,
          "caption": "Invalid atom transformation"
        }
      ]
    }
  ],
  "global_notes": [
    "Route 1 is expected to survive strict gate.",
    "Route 2 is expected to be rejected by strict gate."
  ]
}
